symptoms,topic
"Pain (if cysts are in the outside ear canal or if they get infected),Small soft skin lumps on, behind, or in front of the ear,Gradual , in one ear,Repeated outer ear infections",Benign ear cyst or tumor
"Has the right amounts of carbohydrate, protein, and fat,Provides the digestive proteins, minerals, vitamins, and hormones infants need,Has antibodies that help keep your baby from getting sick 
 

",Benefits of breastfeeding 
,Benefits of quitting tobacco
"Prevent cancer,Screen or test for cancer,Treat or manage cancer,Reduce symptoms or side effects of cancer or cancer treatments",A guide to clinical trials for cancer
,Cryoglobulins
"Breathing problems,Fatigue,Joint pain,Muscle pain,Skin death,Skin ulcers",Cryoglobulinemia
,Benign
,Crying in infancy
,Crying in childhood
"Boredom or loneliness,Discomfort or irritation from a wet or dirty diaper, excessive gas, or feeling cold,Hunger or thirst,Illness,Infection (a likely cause if the crying is accompanied by irritability, ,, ,, or ,. You should call your baby's health care provider),Medicines,Normal muscle jerks and twitches that disturb the sleep,Pain",Crying - excessive (0 to 6 months)
,Crutches and children - stairs
"Slide forward to the edge of the chair.,Hold both crutches on his injured side. Lean forward. Hold the chair arm with the other hand.,Push up on the handgrip of the crutch and the arm of the chair.,Stand up putting weight onto the good leg.,Put crutches under the arms to start walking. ",Crutches and children - sitting and getting up from a chair
"Put the rubber caps on the underarm pads, hand grips, and feet.,Adjust the crutches to the right length. With the crutches upright and your child standing, make sure you can put 2 fingers between your child's underarm and the top of the crutches. Crutch pads against the armpit can give your child a rash and put pressure on nerves and blood vessels in the arm. Too much pressure can damage nerves and blood vessels.,Adjust the height of the handgrips. They should be where your child's wrists are when their arms are hanging by their side or hip. The elbows should be gently bent when standing up and holding the handgrips,Make sure your child's elbows are slightly bent when starting to use the crutch, then extended when taking a step. ",Crutches and children - proper fit and safety tips
"Stand on the good foot. Hold the crutches against the side of the body. Squeeze them with using the arms and side of body.,Move the crutches about one step in front, with the crutches out a little wider than his feet. Move the hurt leg forward with the crutches.,Push down on the crutches with his hands on the handgrips. Squeeze the crutches between the arms and sides.,Put his weight on the handgrips and move forward.,DO NOT lean on the crutches on the armpits. Putting weight on the armpits can hurt, and your child can get a rash and damage nerves and blood vessels under his arm.,Hop forward on the good foot just a little in front of the crutches. This is one step.,Start the next step by moving the crutches about one step in front with the injured leg.,Look ahead when walking, not at the feet. ",Crutches and children - standing and walking
,Crush injury
,Croup
,Crohn disease - discharge
"Cry that is high-pitched and may sound like a cat,Downward slant to the eyes,
   Low birth weight and slow growth,Partial webbing or fusing of fingers or toes,Single line in the palm of the hand,Skin tags just in front of the ear,Slow or incomplete development of motor skills,Small head (,),Small jaw (,),Wide-set eyes",Cri du chat syndrome
" that gets worse quickly over a few weeks or months,Blurred vision (sometimes), (walking),, disorientation,Hallucinations (seeing things that aren't there),Lack of coordination (for example, stumbling and falling),Muscle stiffness,Nervous, jumpy feelings,Personality changes,Sudden jerky movements or seizures,Trouble speaking",Creutzfeldt-Jakob disease
", may be more severe at night,Raised, snakelike tracks in the skin that may spread over time, usually about 1 cm (less than one half inch) per day, usually on the feet and legs (severe infections may cause several tracks). ",Creeping eruption
"Antibiotics such as cefoxitin or trimethoprim,Cimetidine ",Creatinine urine test
" and changes in thinking,Yellow skin (jaundice) and yellow in the whites of the eyes (icterus), which begin a few days after birth and get worse over time",Crigler-Najjar syndrome
"No missing, loose, broken, or poorly installed screws, brackets, or other hardware on the crib,No cracked or peeling paint,No more than 2 3/8 inches, or 6 centimeters, (about the width of a soda can) between crib slats, so that a baby's body cannot fit through the slats,No missing or cracked slats,No corner posts over 1/16th inch (1.6 millimeters) high, so that they will not catch on the baby's clothing,No cutouts in the headboard or foot board, so that the baby's head will not get trapped ",Cribs and crib safety
,Creatinine clearance test
"Cimetidine, famotidine, and ranitidine,Certain antibiotics, such as trimethoprim ",Creatinine blood test
"Parents,Grandparents,Aunts and Uncles,Cousins,Sisters and brothers ,Why you are gathering this information,How it will help you and others in your family ,Date of birth or approximate age,Where the person grew up and lived,Any health habits they are willing to share, such as smoking or drinking alcohol,Medical conditions, long-term (chronic) conditions such as asthma, and serious conditions such as cancer,Any history of mental illness,Age at which they developed the medical condition,Any learning problems or developmental disabilities,Birth defects,Problems with pregnancies or childbirth,The age and cause of death for relatives who are deceased,Which country/region your family originally came from (Ireland, Germany, Eastern Europe, Africa, and so on) ",Creating a family health history
"Soft areas of the skull, especially along the suture line,Soft areas pop in and out,Bones may feel soft, flexible, and thin along the suture lines ",Craniotabes
,Creatine phosphokinase test
"To relieve pressure on the child's brain,To make sure there is enough room in the skull to allow the brain to properly grow,To improve the appearance of the child's head ",Craniosynostosis repair
"No ""soft spot"" (fontanelle) on the newborn's skull,A raised hard ridge along the affected sutures,Unusual head shape,Slow or no increase in the head size over time as the baby grows ,Sagittal synostosis (scaphocephaly) is the most common type. It affects the main suture on the very top of the head. The early closing forces the head to grow long and narrow, instead of wide. Babies with this type tend to have a broad forehead. It is more common in boys than girls.,Frontal plagiocephaly is the next most common type. It affects the suture that runs from ear to ear on the top of the head. It is more common in girls.,Metopic synostosis is a rare form that affects the suture close to the forehead. The child's head shape may be described as trigonocephaly. It may range from mild to severe. ",Craniosynostosis
"The surgeon made 2 to 3 small cuts (incisions) on your baby's scalp.,Pieces of abnormal bone were removed.,The surgeon either reshaped these bone pieces and put them back in, or left the pieces out.,A plate and some small screws were put in place to help hold the bones in the right position. ",Craniosynostosis repair - discharge 
"Increasing pressure on the brain, usually from ,Disrupting hormone production by the pituitary gland,Pressure or ,Headache,Nausea,Vomiting (especially in the morning)",Craniopharyngioma
,Cranial sutures
" when looking to one side,Headaches,Pain around the eye ",Cranial mononeuropathy VI
"Drooping of one eyelid (ptosis),Pain in the head or behind the eye ",Cranial mononeuropathy III - diabetic type
", which is the most common symptom,Drooping of one eyelid (ptosis),Enlarged pupil that does not get smaller when a light shines on it,Headache or eye pain ",Cranial mononeuropathy III
"Thick, crusty, yellow or brown scales on your child's scalp,Scales may also be found on the eyelids, ear, around the nose,Older infant scratching affected areas, which may lead to infection (redness, bleeding, or crusting)",Cradle cap
"Choking,Drowning,Electrical shock,Excessive bleeding,Head trauma or serious injury,Lung disease,Poisoning,Suffocation",CPR - infant
"Choking,Drowning,Electrical shock,Excessive bleeding,Head trauma or serious injury,Lung disease,Poisoning,Suffocation",CPR - child (1 to 8 years old)
"Difficulty closing one eye,Difficulty eating and drinking; food falls out of one side of the mouth, due to lack of control over the muscles of the face,Drooping of the face, such as the eyelid or corner of the mouth,Problems smiling, grimacing, or making facial expressions,Twitching or weakness of the muscles in the face ,Dry eye, which may lead to eye sores or infections,Dry mouth,Headache if there is an infection such as Lyme disease,Loss of sense of ,Sound that is louder in one ear (hyperacusis),Twitching in face ",Bell palsy
"Pressure caused by the unconscious swallowing of air (aerophasia), (GERD) and heartburn ",Belching
,Being active when you have heart disease
"How to take your pulse.,How to recognize your , symptoms and ,.,.",Being active after your heart attack
"Beeswax itself,Some candles",Beeswax poisoning
,Bee poison
"Primary enuresis. Children who have never been consistently dry at night. This most often occurs when the body makes more urine overnight than the bladder can hold, and the child does not wake up when the bladder is full. The child's brain has not learned to respond to the signal that the bladder is full. It is not the child's or the parent's fault. This is the most common reason for bedwetting.,Secondary enuresis. Children who were dry for at least 6 months, but start bedwetting again. There are many reasons that children wet the bed after being fully toilet trained. It might be physical, emotional, or just a change in sleep. This is less common, but still not the fault of the child or parent. ,Lower spinal cord lesions,Birth defects of the genitourinary tract,Urinary tract infections,Diabetes ",Bedwetting
,Bedtime habits
"Premature or preterm changes in the cervix,Problems with the placenta,More than one baby,History of early birth or miscarriage,Baby is not growing well,Baby has medical problems",Bed rest during pregnancy
"Large size for a newborn,Red birth mark on forehead or eyelids (,),Creases in ear lobes,Large tongue (macroglossia),Low blood sugar,Abdominal wall defect (, or ,),Enlargement of some organs,Overgrowth of one side of the body (hemihyperplasia/hemihypertrophy),Tumor growth, such as Wilms tumors and hepatoblastomas ",Beckwith-Wiedemann syndrome
"Difficulty walking that gets worse over time; by age 25 to 30, the person is usually unable to walk,Frequent falls,Difficulty getting up from the floor and climbing stairs,Difficulty with running, hopping, and jumping,Loss of muscle mass,Toe walking,Muscle weakness in the arms, neck, and other areas is not as severe as in the lower body ,Breathing problems,Cognitive problems (these do not get worse over time),Loss of balance and coordination ",Becker muscular dystrophy
,Bathroom safety - children
"Put non-slip suction mats or rubber silicone decals in the bottom of your tub to prevent falls.,Use a non-skid bath mat outside the tub for firm footing.,If you do not already have one, install a single lever on your faucet to mix hot and cold water together.,Set the temperature on your water heater to 120°F (49°C) to prevent burns.,Sit on a bath chair or bench when taking a shower.,Keep the floor outside the tub or shower dry. ",Bathroom safety - adults
"Stay close enough to children who are in the tub so that you can reach out and hold them if they slip or fall.,Use non-skid decals or a mat inside the tub to prevent slipping.,Use toys in the tub to keep your child busy and sitting down, and away from the faucet.,Keep the temperature of your water heater below 120°F (48.9°C) to prevent burns.,Keep all sharp objects, such as razors and scissors, out of your child's reach.,Unplug all electric items, such as hair dryers and radios.,Empty the tub after bath time is over.,Keep the floor and your child's feet dry to prevent slipping. ",Bathing an infant
"Large bowl of warm water,Soap (regular or non-rinse soap),Two washcloths or sponges,Dry towel,Lotion,Shaving supplies, if you are planning to shave the patient,Comb or other hair care products ",Bathing a patient in bed 
"Balance and coordination difficulties,Curvature of spine,Decreased vision that gets worse over time,Developmental delay,Failure to thrive (grow) in infancy,Muscle weakness,Poor muscle coordination that usually develops after age 10,Protruding abdomen,Slurred speech,Stool abnormalities, including fatty stools that appear pale in color, frothy stools, and abnormally foul-smelling stools",Bassen-Kornzweig syndrome
,Basic metabolic panel
"Movement changes, such as involuntary or slowed movements,Increased muscle tone,Muscle spasms and muscle rigidity,Problems finding words,Tremor,Uncontrollable, repeated movements, speech, or cries (tics),Walking difficulty",Basal ganglia dysfunction
"Pearly or waxy,White or light pink,Flesh-colored or brown,A red, scaly patch of skin,A skin sore that bleeds easily,A sore that does not heal,Oozing or crusting spots in a sore,A scar-like sore without having injured the area,Irregular blood vessels in or around the spot,A sore with a depressed (sunken) area in the middle",Basal cell skin cancer
"Rate of weight gain is much lower than that of other children of similar age and gender (,),Needing to urinate more often than usual (,),Low blood pressure,Kidney stones,	Muscle cramping and weakness",Bartter syndrome
"A tender lump on either side of the vaginal opening,Pain with sexual intercourse ",Bartholin cyst or abscess
,Barrett esophagus
"Clear coffee or tea,Fat-free bouillon or broth,Gelatin,Sports drinks without added color,Strained fruit juices,Water ",Barium enema
"Altered level of consciousness,Difficulty in thinking,Drowsiness or coma,Faulty judgment,Lack of coordination,Shallow breathing,Slow, slurred speech,Sluggishness,Staggering ,Changes in alertness,Decreased functioning,Irritability,Memory loss ",Barbiturate intoxication and overdose
"Redness of foreskin or ,Other rashes on the head of the penis,Foul-smelling discharge,Painful penis and foreskin",Balanitis
,Baking soda overdose
"White or gray vaginal discharge that smells fishy or unpleasant,Burning when you urinate,Itching inside and outside the vagina ",Bacterial vaginosis - aftercare
,BAER - brainstem auditory evoked response
,Baker cyst
,Back pain - when you see the doctor
 and vomiting,Bacterial gastroenteritis
,Baking powder overdose
"Exercise a little every day. Walking is a good way to keep your heart healthy and your muscles strong. If walking is too hard for you, work with a physical therapist to develop an exercise plan that you can do.,Keep doing the exercises you have been shown to strengthen your core muscles, which support your back. A stronger core will decrease your risk of further back injuries. ,Adjust your car seat to make it easier to enter, sit in, and get out of your car. Bring your seat as far forward as possible to avoid bending forward when you are driving.,If you drive long distances, stop and walk around every hour.,DO NOT lift heavy objects right after a long car ride. ",Back pain - returning to work
"Over-the-counter antibiotic ointments and sprays such as Polysporin Spray and Neosporin,Prescription antibiotic eye drops and ointments such as Neosporin Ophthalmic",Bacitracin zinc overdose
"Drug overdose
 ,Excessive bleeding
 ,Heart problem (heart attack or abnormal heart rhythm, fluid in the lungs or compressing the heart)
 ,Infection in the bloodstream (,)
 ,Injuries and accidents,Drowning,Stroke,Choking,Drowning,Electrical shock,Excessive bleeding,Head trauma or serious injury,Lung disease,Poisoning,Suffocation",CPR - adult and child 9 years and older
"Avoid mountain biking.,Ride a bike that fits you properly. Staff at a good bike shop can help you get fitted.,Remember not only to push down on the pedals, but also to pull up on them.,Wear biking gloves and use a handlebar cover to reduce jarring in your upper body.,Put shock absorbers on the front wheel.,A more upright bike can have less pressure on your lower back and neck.,Recumbent bikes place less stress on your back and neck. ",Back pain and sports
,CPR
"Alcohol,Amphotericin B,Certain anesthetics,Cocaine,Fibrate drugs,Statins,Steroids, such as dexamethasone ",CPK isoenzymes test
,Cow's milk and children
"Sugars,Starches,Fiber ,Fruits,Milk and milk products ,Candy,Cookies, cakes, and pastries,Regular (non-diet) carbonated beverages, such as soda,Heavy syrups, such as those added to canned fruit ,Bread,Cereal,Legumes, such as beans and chickpeas,Pasta,Rice,Starchy vegetables, such as potatoes ",Counting carbohydrates
"Keep bones and muscles strong,Determine hair growth and where fat is on the body,Make sperm,Maintain sex drive,Make red blood cells,Boost energy and mood",Could you have low testosterone?
,Cow's milk - infants
"
  Blood clot in the lung
  ,
  Breathing food or other material into the lungs (pulmonary aspiration)
  , with biopsy
  ,Cancer,Inflammation of the blood vessels in the lung (vasculitis),Injury to the arteries of the lungs,Irritation of the throat from violent coughing (small amounts of blood), or other lung infections,Very thin blood (from blood thinning medications, most often at higher than recommended levels)",Coughing up blood
"If you have a dry, tickling cough, try cough drops or hard candy. Never give these to a child under age 3, because they can cause choking.,Use a vaporizer or take a steamy shower. These increase moisture in the air and help soothe a dry throat.,Drink plenty of fluids. Liquids help thin the mucus in your throat making it easier to cough it up.,DO NOT smoke and stay away from secondhand smoke ,Guaifenesin helps break up mucus. Follow package instructions on how much to take. DO NOT take more than the recommended amount. Drink lots of fluids if you take this medicine.,Decongestants help clear a runny nose and relieve postnasal drip. Check with your doctor before taking decongestants if you have high blood pressure.,Talk to your child's doctor before you give children ages 6 years or younger an over-the-counter cough medicine, even if it is labeled for children. These medicines likely do not work for children, and can have serious side effects. ,Stay indoors during days or times of the day (usually the morning) when airborne allergens are high.,Keep windows closed and use an air conditioner.,DO NOT use fans that draw in air from outdoors.,Shower and change your clothes after being outside. ",Cough
"Sharp pain at the front of your chest wall, which may move to your back or stomach,Increased pain when you take a deep breath or cough,Tenderness when you press the area where the rib joins the breastbone,Less pain when you stop moving and breathe quietly",Costochondritis
,Cosmetic ear surgery
,Cosmetic breast surgery - discharge
"Anti-seizure drugs,Estrogen,Human-made (synthetic) glucocorticoids, such as hydrocortisone, prednisone and prednisolone,Androgens ",Cortisol urine test
"Anti-seizure drugs,Estrogen,Human-made (synthetic) glucocorticoids, such as hydrocortisone, prednisone and prednisolone,Androgens",Cortisol blood test
"It may feel heavy or like someone is squeezing your heart. You may feel it under your breast bone (sternum). You may also feel it in your neck, arms, stomach, or upper back.,The pain most often occurs with activity or emotion. It goes away with rest or a medicine called nitroglycerin.,Other symptoms include shortness of breath and fatigue with activity (exertion). ,Fatigue,Shortness of breath,General weakness ",Coronary heart disease
"Alclometasone dipropionate (Delonal)
  ,Augmented betamethasone dipropionate (Deprolene)
  ,Beclomethasone dipropionate (Diprosone)
  ,Betamethasone sodium phosphate (Celestone)
  ,Betamethasone valerate (Valisone)
  ,Clobetasol propionate (Temovate)
  ,Clocortolone pivalate (Cloderm)
  ,Desonide (DesOwen, Tridesilon)
  ,Desoximetasone (Topicort)
  ,Dexamethasone (Decadron)
  ,Fluocinonide (Lidex)
  ,Flunisolide (AeroBid)
  ,Fluocinolone acetonide (Synalar)
  ,Flurandrenolide (Cordran)
  ,Fluticasone propionate (Cutivate)
  ,Halcinonide (Halog)
  ,Hydrocortisone (Cortef)
  ,Hydrocortisone sodium phosphate (Solu-Cortef)
  ,Hydrocortisone valerate (Westcort)
  ,Methylprednisolone (Medrol)
  ,Methylprednisolone sodium succinate (Solu-Medrol)
  ,Mometasone furoate (Elocon)
  ,Prednisolone sodium phosphate (Pred Fonte)
  ,Prednisone (Deltasone)
  ,Triamcinolone acetonide (Aristocort)",Corticosteroids overdose
"Heart murmur,Chest discomfort or pain,Easy fatigue,Failure to thrive,Fast or irregular heartbeat (palpitations),Shortness of breath (dyspnea) ",Coronary artery fistula
"Constricting,Crushing,Pressure,Squeezing,Tightness ,Often occurs at rest,May occur at the same time each day, usually between midnight and 8:00 a.m.,Lasts from 5 to 30 minutes ",Coronary artery spasm
"Are allergic to any medicines or if you have had a bad reaction to contrast material in the past,Are taking Viagra,Might be pregnant ",Coronary angiography
"Skin is thick and hardened.,Skin may be flaky and dry.,Hardened, thick skin areas are found on hands, feet, or other areas that may be rubbed or pressed.,The affected areas can be painful and may bleed. ",Corns and calluses
"Blurry or hazy vision,Eye that appears red or bloodshot, (photophobia),Very painful and ,White patch on the cornea ",Corneal ulcers and infections
,Corneal transplant - discharge 
"Blurred vision, or stinging and burning in the eye,Feeling like something is in your eye (may be caused by a scratch or something in your eye),Swollen eyelids,Watery eyes or increased tearing ",Corneal injury
,Cord blood testing
"Fainting spells during activity,Chest discomfort, usually in the front of the chest,Chest pain,Swelling of the feet or ankles,Symptoms of lung disorders, such as wheezing or coughing,Bluish lips and fingers (cyanosis)",Cor pulmonale
"Certain coins - all pennies in the United States made before 1982 contained copper,Certain insecticides and fungicides,Copper wire,Some aquarium products,Vitamin and mineral supplements (copper is an essential micronutrient, but too much can be deadly) ",Copper poisoning
,Coping with cancer - looking and feeling your best
,Copper in diet
"Some cancers release proteins called cytokines that can make you feel fatigued.,Some tumors can change the way your body uses energy and leave you feeling tired. ,. You may feel most worn out for a few days after each chemo treatment. Your fatigue may get worse with each treatment. For some people, fatigue is worst about halfway through the full course of chemo.,. Fatigue often gets more intense with each radiation treatment until about halfway through the cycle. Then it usually levels off and stays about the same until the end of treatment., Fatigue is common when recovering from any surgery. Having surgery along with other cancer treatments can make fatigue last longer.,Biologic therapy. Treatments that use vaccines or bacteria to trigger your immune system to fight cancer can cause fatigue. ,. Some cancer treatments decrease kill red blood cells that carry oxygen from your heart to the rest of your body., Nausea or lost appetite can make it hard to keep your body fueled. Even if your eating habits do not change, your body may have trouble taking in nutrients during cancer treatment., Having cancer can make you feel anxious, depressed, or distressed. These emotions can drain your energy and motivation., Many of the medicines for treating pain, depression, insomnia, and nausea can also cause fatigue., Pain, distress, and other cancer side effects can make it hard to get truly rested. ",Coping with cancer - managing fatigue
,Coping with cancer - hair loss
"Clinical care from a registered nurse,Home visits from a physical therapist or social worker,Help with personal care like bathing or dressing,Help running errands or making meals ",Coping with cancer - finding the support you need
"Vision problems caused by thinning of the cornea, most often due to ,. (A transplant may be considered when less invasive treatments are not an option.),Scarring of the cornea from severe infections or injuries,Vision loss caused by cloudiness of the cornea, most often due to ",Corneal transplant
"Being around smoke or other pollutants,Weather changes,Doing too much activity,Being run-down,Feeling stressed or anxious",COPD flare-ups
"Take medicines and treatments as directed.,If you smoke, quit. Also avoid secondhand smoke. Avoiding smoke is the best way to slow down damage to your lungs. Ask your doctor about stop-smoking programs and other options, such as nicotine replacement therapy and tobacco cessation medicines.,Discuss the risks and side effects of your medicines with your doctor. There may be better options available or things you can do to reduce or offset the harms. Tell your doctor if you notice any side effects.,Have a yearly flu vaccine and a , vaccine to help guard against infections. Wash your hands often. Stay away from people with colds or other infections.,Stay as active as possible. Try short walks and light weight training. Talk with your doctor about ways to get exercise.,Eat a healthy diet rich in lean proteins, fish, whole grains, fruits, and vegetables. Eating several small healthy meals a day can give you the nutrients you need without feeling bloated. An overfull belly can make it hard to breathe.,Talk with your doctor if you ,. There are programs and medicines that can help you feel more positive and hopeful. ",COPD and other health problems
,Bacitracin overdose
,Babinski reflex
