symptoms,topic
"Cancer that has spread (metastasized) to the brain from another part of the body,A slow-growing tumor of the nerve that connects the ear to the brain (,),Tumors that are not cancer (chordoma, meningioma) ,Blood vessel problems (,, ,),Some types of , (severe nerve pain of the face),Severe tremors due to , or ",Stereotactic radiosurgery - Gamma Knife
"Cancer that has spread (metastasized) to the brain from another part of the body,A slow-growing tumor of the nerve that connects the ear to the brain (,),Spinal cord tumors ,Breast,Kidney,Liver,Lung,Pancreas,Prostate,A type of skin cancer (melanoma) that involves the eye ,Blood vessel problems such as ,Severe tremors (shaking),Some types of , (severe nerve pain of the face) ",Stereotactic radiosurgery - CyberKnife
"You may feel some discomfort where the pins used to be. Bandages may be placed over the pin sites.,You can wash your hair after 24 hours.,DO NOT use hair coloring, perms, gels, or other hair products until the sites where the pins were placed are completely healed.,Clean the anchors and the surrounding skin 3 times a day.,DO NOT wash your hair while the anchors are in place.,A scarf or a lightweight hat may be worn to cover the anchors.,When the anchors are removed, you'll have small wounds to care for. DO NOT wash your hair until any staples are removed.,DO NOT use hair coloring, perms, gels, or other hair products until the sites where the anchors were placed are completely healed.,Watch the areas where the anchors are still in place, or where they were removed, for redness and drainage.",Stereotactic radiosurgery - discharge 
"Your doctor or midwife will discuss your current health, your health history, and your family's health history. Some health problems in your family can be passed on to your children. Your doctor may refer you to a genetic counselor.,You may need blood tests, or you may need to get caught up on vaccines before you are pregnant.,Your doctor or midwife will talk with you about medicines, herbs, and supplements you may be taking. They can affect an unborn baby. Your provider may recommend medicine changes before you get pregnant.,Long-term health problems, such as asthma or diabetes, should be stable before you get pregnant.,If you are obese, your provider will recommend losing weight before pregnancy. Doing so will reduce your risk of complications in pregnancy. ",Steps to take before you get pregnant
"Low count of healthy red blood cells (,),Swelling of the spleen (,),Yellow color of the skin, mucous membranes, or white part of the eyes (,),Neurologic condition, called ,, that affects the brain,Fatigue, lethargy,Pale skin (,),In infants, not gaining weight and growing as expected (,),Gallstones, usually in the teens and older ",Pyruvate kinase deficiency
,Pyruvate kinase blood test
"Chest pain (lower right),Pain in the right upper abdomen (more common) or throughout the abdomen (less common),Clay-colored stools,Dark urine,Fever, chills, nightsweats,Nausea, vomiting,Yellow skin (jaundice)",Pyogenic liver abscess
"A small red lump on the skin that bleeds easily,Often found at the site of a recent injury,Usually seen on hands, arms, and face, but they may develop in the mouth (most often in pregnant women) ",Pyogenic granuloma
,Pyloroplasty
"Vomiting may occur after every feeding or only after some feedings,Vomiting usually starts around 3 weeks of age, but may start any time between 1 week and 5 months of age,Vomiting is forceful (projectile vomiting),The infant is hungry after vomiting and wants to feed again,Abdominal pain,Burping,Constant hunger,Dehydration (gets worse as vomiting gets worse),Failure to gain weight or weight loss,Wave-like motion of the abdomen shortly after feeding and just before vomiting occurs",Pyloric stenosis - infant
"Amyloidosis,Blood clotting disorders,Congenital , syndrome,Drugs that affect platelet function,Fragile blood vessels seen in older people (senile purpura),Inflammation of the blood vessels (vasculitis), such as ,, which causes a raised type of purpura,Pressure changes that occur during vaginal childbirth, (vitamin C deficiency),Steroid use,Certain infections,Injury ,Drugs that reduce the platelet count,Immune neonatal , (can occur in infants whose mothers have ITP),, a raised type of purpura ",Purpura
,Pustules
"Coats' disease - exudative retinopathy, (may be hereditary or may result from other conditions, including ,, ,, ,),Persistent primary hyperplastic vitreous,Toxocara canis (infection caused by a parasite)",Pupil - white spots
"You have other symptoms along with increased pulse.,The change in your pulse does not go away when you rest for a few minutes.,You already have been diagnosed with a heart problem.",Pulse - bounding
,Pulse
,Pulmonary ventilation/perfusion scan
,Pulmonary veno-occlusive disease
" (cyanosis) in some people,Poor appetite,Poor weight gain or , in infants with a severe blockage,Sudden death ",Pulmonary valve stenosis
"Breathing difficulty,Chest pain,Cough (usually with mucus),Coughing up blood,Excessive sweating, especially at night,Fatigue,Fever,Weight loss,Wheezing ",Pulmonary tuberculosis
" (comes and goes),General ill feeling (,),Night sweats ,Nausea,Liver and spleen swelling (,),Unintentional weight loss,Vomiting ,Breathing difficulty,Chest pain not due to heart problems,Coughing up blood or mucus,Rapid breathing,Change in mental state,Confusion,Dizziness,Headache,Seizures ,Skin rashes or lumps,Skin sores (abscesses)",Pulmonary nocardiosis
"Ask the doctor or therapist how far to walk.,Slowly increase how far you walk.,Try not to talk when you walk so you do not get out of breath.,Stop if you have chest pain or feel dizzy. ,Use small weights or rubber tubing to make your arms and shoulders stronger.,Stand up and sit down several times.,Raise your legs straight out in front of you. Hold for a few seconds, then lower them back down. ",Pulmonary hypertension - at home 
"Under the breastbone or on one side,Sharp or stabbing,Burning, aching, or a dull, heavy sensation,Often gets worse with deep breathing,You may bend over or hold your chest in response to the pain,Bluish skin (cyanosis),Dizziness, lightheadedness, or fainting,Fast breathing or wheezing,Fast heart rate,Feeling anxious,Leg pain, redness, or swelling,Low blood pressure,Sudden cough, possibly coughing up blood or bloody mucus,Shortness of breath that starts suddenly,Sweating, clammy skin",Pulmonary embolus
"Coughing up blood or bloody froth,Difficulty breathing when lying down (orthopnea),Feeling of ""air hunger"" or ""drowning"" (This feeling is called ""paroxysmal nocturnal dyspnea"" if it causes you to wake up and try to catch your breath.),Grunting, gurgling, or wheezing sounds with breathing,Problems speaking in full sentences because of shortness of breath ,Anxiety or restlessness,Decrease in level of alertness,Leg or abdominal swelling,Pale skin,Sweating (excessive) ",Pulmonary edema
"Ankle and leg swelling,Bluish color of the lips or skin (,), or pressure, usually in the front of the chest, or , spells,Increased abdomen size",Pulmonary hypertension
"Bluish colored skin (cyanosis),Fast breathing,Fatigue,Poor eating habits (babies may get tired while nursing or sweat during feedings),Shortness of breath",Pulmonary atresia
"Difficulty exercising,Nosebleeds,Shortness of breath with exertion,Blue skin (,), of the fingers",Pulmonary arteriovenous fistula
,Pulmonary function tests
"Chest pain,Fatigue",Pulmonary aspergilloma
"If you are pregnant,If you have ever had any allergic reactions to x-ray contrast material or iodine substances,If you are allergic to any medicines,Which medicines you are taking (including any herbal preparations),If you have ever had any bleeding problems ",Pulmonary angiography
" when taking a deep breath, with phlegm (sputum) ,Night sweats",Pulmonary actinomycosis
Fever,Pulmonary alveolar proteinosis
,Tympanometry
,Twin-to-twin transfusion syndrome
"Some floor and furniture waxes and polishes,Some paint brush cleaners,Pure turpentine",Turpentine oil poisoning
"Explain to the patient what you are planning to do so the person knows what to expect. Encourage the person to help you if possible.,Stand on the side of the bed the patient will be turning towards and lower the bed rail.,Ask the patient to look towards you. This will be the direction in which the person is turning.,Move the patient to the center of the bed so the person is not at risk of rolling out of the bed.,The patient's bottom arm should be stretched towards you. Place the person's top arm across the chest.,Cross the patient's upper ankle over the bottom ankle. ",Turning patients over in bed
"Ears are low-set.,Neck appears wide or weblike.,Roof of the mouth is narrow (high palate).,Hairline at the back of the head is lower. ,Lower jaw is lower and appears to fade away (recede).,Drooping eyelids and dry eyes.,Fingers and toes are short.,Hands and feet are swollen in infants.,Nails are narrow and turn upward.,Chest is broad and flat. Nipples appear more widely spaced.,Height at birth is often smaller than average.,Pubic hair is often present and normal.,Breast development may not occur.,Menstrual periods are absent or very light,Vaginal dryness and pain with intercourse are common.,Infertility",Turner syndrome
"Fatigue,Loss of appetite,Night sweats,Weight loss",Tumor
"Chills,Eye irritation (,, if the infection began in the eye),Red spot on the skin, growing to become a sore (ulcer)",Tularemia
"You have trouble breathing though your nose because the airways are swollen or blocked.,Other treatments, such as allergy medicines, allergy shots, and nose sprays have not helped your breathing. ",Turbinate surgery
"Areas of the skin that are white (due to decreased pigment) and have either an ash leaf or confetti appearance,Red patches on the face containing many blood vessels (adenoma sebaceum),Raised patches of skin with an orange-peel texture (shagreen spots), often on the back , spectrum disorders,Developmental delays,Pitted tooth enamel,Rough growths under or around the fingernails and toenails,Rubbery noncancerous tumors on or around the tongue ",Tuberous sclerosis
,Tubercle
,Tubal ligation reversal
"Shoulder pain,Scratchy or sore throat,Swollen belly (bloated) and crampy,Some discharge or bleeding from your vagina",Tubal ligation - discharge 
,Tubal ligation
,TSI test
"Amiodarone,Dopamine,Lithium,Potassium iodide,Prednisone or other glucocorticoid medicines ",TSH test
"Cheese,Chicken,Chocolate,Eggs,Fish,Milk,Peanut butter,Peanuts,Pumpkin seeds,Sesame seeds,Soy,Tofu,Turkey",Tryptophan
,Trypsinogen test
"Delayed growth or growth failure,Fatigue,Lethargy,Poor feeding,Rapid breathing (tachypnea),Shortness of breath (dyspnea),Widening of the finger tips (clubbing) ",Truncus arteriosus
,Troponin test
"Diarrhea, worse on a high-fat diet,Fatigue,Fever,Leg swelling",Tropical sprue
"Overuse or stress on the hip from exercising or standing for long periods,Hip injury, such as from a fall,Having one leg that is longer than the other,Bone spurs on the hip,Spine problems, including , and arthritis of the spine,Muscle imbalance that puts more stress around the hip muscles,Infection (rare) ,Diabetes,Thyroid disease ",Trochanteric bursitis
"Clenched hands,Crossed legs,Feet with a rounded bottom (rocker-bottom feet),Low-set ears,Mental delay,Poorly developed fingernails,Small head (,),Small jaw (,),Unusual shaped chest (,) ",Trisomy 18
"Clenched hands (with outer fingers on top of the inner fingers),Close-set eyes -- eyes may actually fuse together into 1,Decreased muscle tone,Extra fingers or toes (,),Hernias: ,, ,Hole, split, or cleft in the iris (,),Low-set ears,, severe,Scalp defects (missing skin),Small eyes,Small head (,),Small lower jaw (,),Undescended testicle (,)",Trisomy 13
"Some automatic dishwashing soaps,Some ,Many industrial solvents and cleaners (hundreds to thousands of construction agents, flooring strippers, brick cleaners, cements, and many others) ",Trisodium phosphate poisoning
"Make sure your doctor knows what medicines you take, including over-the-counter drugs and supplements.,Your health care provider will tell you if you need to stop taking any medicines before you have this test. ,Do not stop or change your medications without talking to your doctor first.",Triglyceride level
,Trypsin and chymotrypsin in stool
"If the tunnel swells, or the tendon has a bump on it, the tendon cannot slide smoothly through the tunnel.,When it cannot slide smoothly, the tendon may become stuck when you try to straighten your finger. ,Your finger is stiff or it locks in a bent position.,You have painful snapping or popping when you bend and straighten your finger.,Your symptoms are worse in the morning.,You have a tender bump on the palm side of your hand at the base of your finger. ,Are over 45 years old,Are female,Have ,, ,, or ,Do work or activities that require repeated gripping of their hands ",Trigger finger
"Very painful, sharp electric-like spasms that usually last a few seconds or minutes, but can become constant.,Pain is usually only on one side of the face, often around the eye, cheek, and lower part of the face.,There is usually no loss of sensation or movement of the affected part of the face.,Pain may be triggered by touch or sounds.",Trigeminal neuralgia
"Active pulsing in the neck veins,Decreased ,, tiredness,General swelling, and ankles",Tricuspid regurgitation
"Fast breathing,Fatigue,Poor growth,Shortness of breath",Tricuspid atresia
"An uneven appearance to the hair,Bare patches or all around (diffuse) loss of hair,Bowel blockage (obstruction) if people eat the hair they pull out,Constant tugging, pulling, or twisting of hair,Denying the hair pulling,Hair regrowth that feels like stubble in the bare spots,Increasing sense of tension before the hair pulling,Other self-injury behaviors,Sense of relief, pleasure, or gratification after the hair pulling,Feeling sad or depressed,Anxiety,Poor self-image",Trichotillomania
,Trichorrhexis nodosa
"Discomfort with intercourse,Itching of the inner thighs,Vaginal discharge (thin, greenish-yellow, frothy or foamy), or swelling of the labia,Vaginal odor (foul or strong smell) ,Burning after urination or ejaculation,Itching of urethra,Slight discharge from urethra ,Swelling and irritation in the prostate gland (,),Swelling in the epididymis (,), the tube that connects the testicle with the vas deferens. The vas deferens connects the testicles to the urethra. ",Trichomoniasis
" (CHD) (angioplasty and stent placement - heart), (angioplasty and stent replacement - peripheral arteries), (aortic aneurysm repair - endovascular), (carotid artery surgery) , (percutaneous urinary procedures),, including , (biliary stricture),Helping you breathe if you have a blockage in the airways ",Stent
"CLR,Faultless Hot Iron Cleaner,Lime Away,Whink Steam Iron Cleaner",Steam iron cleaner poisoning
"Keep a well-stocked first aid kit in your home.,Keep a list of emergency numbers near your telephone. Include the local numbers for fire, police, utility companies, and the National Capital Poison Center (800) 222-1222.,Make sure your house number is easy to see from the street, in case an emergency vehicle needs to look for it. ",Staying safe at home
,Stay away from asthma triggers
,Stay active and exercise - arthritis
"Dull aching or heaviness in the leg,Pain that gets worse when you stand,Swelling in the leg,Thickening and hardening of the skin on the legs and ankles (lipodermatosclerosis),A bumpy or cobblestone appearance of the skin,Dark brown color",Stasis dermatitis and ulcers
"Cooking starch,Cosmetic products,Laundry products (laundry starch)",Starch poisoning
,Staph infections - self-care at home
"Being in a hospital or other type of care facility for a long time,Having a weakened immune system or ongoing (chronic) illness,Having an open cut or sore,Having a medical device inside your body such as an artificial joint,Injecting illegal drugs,Living with or having close contact with a person who has staph,Being on kidney dialysis",Staph infections - hospital
,Standard ophthalmic exam
"Arm (most often the left),Back,Jaw,Neck,Shoulder,Fatigue,Shortness of breath,Weakness,Dizziness or lightheadedness,Nausea, vomiting, and sweating,Most often comes on after activity or stress,Lasts an average of 1 to 15 minutes,Is relieved with rest or a medicine called nitroglycerin",Stable angina
,Squamous cell skin cancer
,Sputum stain for mycobacteria
,Sputum Gram stain
,Sputum fungal smear 
" or ,Joint stiffness,Discoloration of the skin, especially ",Sprains
"Find out if you are in good health,Measure the maturity of your body,Measure your physical fitness,Learn about injuries you have now,Find conditions you may have been born with that could make you more likely to be injured ",Sports physical
,Sports cream overdose
,Sporotrichosis
,Spores
"Lower back pain,Muscle tightness (tight hamstring muscle),Pain, numbness, or tingling in the thighs and buttocks,Stiffness,Tenderness in the area of the vertebra that is out of place,Weakness in the legs",Spondylolisthesis
,Sputum direct fluorescent antibody (DFA) test
,Splinter removal
"Bacterial endocarditis,Injury to the nail ",Splinter hemorrhages
"Infections,Liver diseases ,Blood diseases ,Cancer",Splenomegaly
,Splenic infarction
"Pain around the incision for a few weeks. This pain should lessen each day.,Sore throat from the breathing tube that helped you breathe during surgery. Sucking on ice chips or gargling may help soothe your throat.,Nausea and maybe throwing up. Your surgeon can prescribe nausea medicine if you need it.,Bruising or skin redness around your wound. This will go away on its own.,Trouble taking deep breaths. ",Spleen removal - open - adults - discharge 
"Pain around the incisions. When you first get home, you may also feel pain in one or both shoulders. This pain comes from any gas still left in your belly after the surgery. It should go away over several days to a week.,A sore throat from the breathing tube that helped you breathe during surgery. Sucking on ice chips or gargling may be soothing.,Nausea, and maybe throwing up. Your surgeon can prescribe nausea medicine if you need it.,Bruising or redness around your wounds. This will go away on its own.,Problems taking deep breaths. ",Spleen removal - laparoscopic - adults - discharge
"Pain around the incisions for a few days.,Sore throat from the breathing tube. Sucking on ice chips or gargling (if your child is old enough to do these things) can help soothe the throat.,Bruising, skin redness, or pain around the cut, or cuts.,Problems taking deep breaths. ",Spleen removal - child - discharge
" or cyst in the spleen, (thrombosis) in the blood vessels of the spleen,Diseases or disorders of blood cells, such as , (ITP), ,, thalassemia, ,, and ,. These are all rare conditions.,, ,, and ,Other tumors or cancers that affect the spleen,Splenic artery aneurysm (rare),Trauma to the spleen ",Spleen removal
"The muscle at the top of your baby's stomach may not be fully developed. So baby's stomach cannot hold in milk.,The valve at the bottom of the stomach may be too tight. So the stomach gets too full and milk comes out.,Your baby may drink too much milk too fast, and take in a lot of air in the process. These air bubbles fill up the stomach and milk comes out.,Overfeeding causes your baby to get too full. So milk comes up.",Spitting up - self-care
,Pulling a patient up in bed
"Skin reaction that causes skin to turn bluish-gray in color,Sores in the genital area due to bites and scratching ",Pubic lice
,Puberty in girls
,Puberty in boys
"You notice your child has a drooping eyelid,One eyelid suddenly droops or closes",Ptosis - infants and children
,Pterygium
"Disorganized thought and speech,False beliefs that are not based in reality (delusions), especially unfounded fear or suspicion,Hearing, seeing, or feeling things that are not there (,),Thoughts that ""jump"" between unrelated topics (disordered thinking) ",Psychosis
,Psoriatic arthritis
,Psoriasis - resources
"Spots on the skin that are pinkish-red and look like teardrops,Spots may be covered with silver, flaky skin called scales,Spots usually occur on the arms, legs, and middle of the body (the trunk), but may appear in other body areas",Psoriasis - guttate
"Itchy,Dry and covered with silver, flaky skin (scales),Pink-red in color (like the color of salmon),Raised and thick ,Joint pain or aching,, including thick nails, yellow-brown nails, dents in the nail, and a lifting of the nail from the skin underneath,Severe dandruff on the scalp ,Erythrodermic. The skin redness is very intense and covers a large area.,. Small, pink-red spots appear on the skin. This form seems to be linked to strep infections.,Inverse. Skin redness and irritation occur in the armpits, groin, and in between overlapping skin.,Plaque. Thick, red patches of skin are covered by flaky, silver-white scales. This is the most common type of psoriasis.,Pustular. White pus-filled blisters (pustules) are surrounded by red, irritated skin. ",Psoriasis
"Blood-tinged sputum,Dry , and chills,Joint aches, (most often in the head and neck)",Psittacosis
"Headache,Blurred vision,Buzzing sound in the ears (tinnitus),Dizziness, (diplopia),Nausea,Vision loss ",Pseudotumor cerebri
" (mild to severe),Fever,Urge to have a bowel movement,Watery , (often 5 to 10 times per day) ",Pseudomembranous colitis
"Dental problems,Numbness,Seizures,Tetany (a collection of symptoms including muscle twitches and hand and foot spasms) ,Calcium deposits under the skin,Dimples that can replace knuckles on affected fingers,Round face and short neck,Short hand bones, especially the bone below the 4th finger,Short height ",Pseudohypoparathyroidism
"""Little Buddha"" appearance,Delay in sitting and walking,Difficulties coughing",Prune belly syndrome
,Proximal
" or , (softening of the bones),Increased , or ,Pain in the bones, back, flank, or abdomen,Skeletal deformities",Proximal renal tubular acidosis
,Protuberance
,Proton therapy
"Your health care provider will tell you if you need to stop taking any medicines before you have this test. This may include aspirin, heparin, antihistamines, and vitamin C.,DO NOT stop or change your medicines without talking to your doctor first. ",Prothrombin time (PT)
,Protein-losing enteropathy
"Omeprazole (Prilosec), also available over-the-counter (without a prescription),Esomeprazole (Nexium),Lansoprazole (Prevacid),Rabeprazole (AcipHex),Pantoprazole (Protonix),Dexlansoprazole (Dexilant),Zegerid (omeprazole with sodium bicarbonate)",Proton pump inhibitors
"Tell your health care provider about all the medicines you take.,Your provider will tell you if you need to stop taking any medicines before you have this test. This may include drugs that prevent blood clots (blood thinners).,Do not stop or change your medicines without talking to your doctor first.",Protein S blood test
,Protein electrophoresis - serum
"1 oz (30 g) of meat fish or poultry,1 large egg,¼ cup (60 milliliters) tofu,½ cup (65 grams) cooked beans or lentils,1 Tbsp (14 grams) peanut butter ,Turkey or chicken with the skin removed, or bison (also called buffalo meat),Lean cuts of beef or pork, such as round, top sirloin, or tenderloin (trim away any visible fat),Fish or shellfish ,Pinto beans, black beans, kidney beans, lentils, split peas, or garbanzo beans,Nuts and seeds, including almonds, hazelnuts, mixed nuts, peanuts, peanut butter, sunflower seeds, or walnuts (just watch how much you eat, because nuts are high in fat),Tofu, tempeh, and other soy protein products,Low-fat dairy products ",Protein in diet
"Dye (contrast media) if you have a radiology scan within 3 days before the urine test,Strenuous exercise,Urinary tract infection,Urine contaminated with fluids from the vagina",Protein urine test
"It can delay your use of an approved treatment. When you are treating cancer, time is precious. A delay in treatment can allow the cancer to grow and spread. This can make it harder to treat.,Some of these products interfere with standard cancer treatments, such as chemotherapy or radiation. This can make your treatment less effective.,In some cases, these treatments can be harmful. For example, black salves, touted as a miracle cancer cure, can burn off layers of your skin. ",Protecting yourself from cancer scams
,Prosthesis
,Prostatitis- bacterial - self-care
"Blood in the semen,Blood in the urine,Pain in the genital area and lower back,Pain with bowel movements,Pain with ejaculation,Problems with urinating ",Prostatitis - nonbacterial
"Abdominal discomfort,Cramping,Diarrhea,Facial swelling around the eyes, (especially muscle pain with breathing, chewing, or using large muscles),Muscle weakness ",Trichinosis
"Crater-like ulcers between the teeth,Fever,Foul taste in the mouth,Gums appear red and swollen,Grayish film on the gums,Painful gums,Severe gum bleeding in response to any pressure or irritation",Trench mouth
,Tremor - self-care
"Chills,Fever,Flushing of the skin ,Burning or pain with urination,Difficulty starting to urinate or emptying the bladder,Foul-smelling urine,Weak urine stream ,Pain or achiness in the abdomen above the pubic bone, in the lower back, in the area between the genitals and anus, or in the testicles,Pain with ejaculation or blood in the semen,Pain with bowel movements ",Prostatitis - bacterial
"Brain, nerve, or movement disorders, including uncontrolled muscle movements (,), or ,Muscle tiredness or weakness,Normal aging,Stress, anxiety, or fatigue ,Too much coffee or other caffeinated drink",Tremor
